{
  "schema_version": "1.0",
  "artifact_sha256": "364de412fa3587caf36712e12ba96b5b5817451835efa9421f8be65909dc8773",
  "dataset_manifest_sha256": "023efed1e9188ef5704f1d6485f9df0bff1c1db4c53c25f2d92a0aa9ba0a37b4",
  "decision": "approved",
  "reviewer_role": "repository-maintainer",
  "reviewed_at": "2026-09-18T14:00:00Z"
}
