{
    "schema_version":  "1.0",
    "artifact_sha256":  "4820db4fd56f414f5ae0380bf388cb6928c4d48a9c0ea3c7dca08e19a47b7c25",
    "dataset_manifest_sha256":  "023efed1e9188ef5704f1d6485f9df0bff1c1db4c53c25f2d92a0aa9ba0a37b4",
    "decision":  "approved",
    "reviewer_role":  "repository-maintainer",
    "reviewed_at":  "2026-09-19T12:20:00Z"
}
