{
  "schema_version": "1.0",
  "artifact_sha256": "84355386fedc5b11b2d4ff27216e559b7abaed2a432693bc205cc277a2d49294",
  "dataset_manifest_sha256": "023efed1e9188ef5704f1d6485f9df0bff1c1db4c53c25f2d92a0aa9ba0a37b4",
  "decision": "approved",
  "reviewer_role": "repository-maintainer",
  "reviewed_at": "2026-09-18T15:15:00Z"
}
