{
    "schema_version":  "1.0",
    "artifact_sha256":  "46289d24f7f7a2e72ad449a5e7f42f54feaf8b7b6feaec9f6fb2cee785c4db39",
    "dataset_manifest_sha256":  "023efed1e9188ef5704f1d6485f9df0bff1c1db4c53c25f2d92a0aa9ba0a37b4",
    "decision":  "approved",
    "reviewer_role":  "repository-maintainer",
    "reviewed_at":  "2026-09-18T16:05:00Z"
}
