{
  "schema_version": "1.0",
  "artifact_sha256": "5f29e600d4e69fd2f4dd2be5ead418f5840c3e16adc8140c2bb4c4880fffa024",
  "dataset_manifest_sha256": "023efed1e9188ef5704f1d6485f9df0bff1c1db4c53c25f2d92a0aa9ba0a37b4",
  "decision": "approved",
  "reviewer_role": "repository-maintainer",
  "reviewed_at": "2026-09-18T14:00:00Z"
}
