{
    "schema_version":  "1.0",
    "artifact_sha256":  "7fcaf3ff07faabec9df550456cfc88cf1f8cd3da77010117c75c9aec13b728ed",
    "dataset_manifest_sha256":  "023efed1e9188ef5704f1d6485f9df0bff1c1db4c53c25f2d92a0aa9ba0a37b4",
    "decision":  "approved",
    "reviewer_role":  "repository-maintainer",
    "reviewed_at":  "2026-09-18T16:05:00Z"
}
